"id","title","description","link","image_link","price","availability","item_group_id",google_product_category
IB_CA_DE_1,Digitale Thermosflasche,Dank fortschrittlicher Isolierung bleiben Ihre Getränke bis zu 6 Stunden lang heiß oder kalt. Die integrierte Digitalanzeige zeigt die Temperatur in Celsius auf einen Blick an.,https://imperialbazaar.com/de/products/450ml-thermosbecher-digitale-temperaturanzeige,https://cdn.shopify.com/s/files/1/0756/5085/9276/files/6716679e-2e6d-4238-8861-e74a7497fdf9_9fe1e4d7-7b46-40a7-abc7-fbe8dac50c86.jpg?v=1739946160,"EUR 21,95",in stock,IB_CA_DE,Thermosflaschen
IB_TX_DE_2,Verdunkelungsvorhänge (2 Stück),"Dieses Set enthält zwei einzelne Verdunkelungsvorhänge, ideal zum Abdecken eines Standardfensters oder eines Fensterpaares. Das „einfarbige“ Design bezieht sich auf den Stoff in einer einheitlichen Farbe, was für ein elegantes, einheitliches Aussehen sorgt.",https://imperialbazaar.com/de/products/verdunkelungsvorhaenge-2teilig-schlafzimmer-wohnzimmer,https://cdn.shopify.com/s/files/1/0756/5085/9276/files/S718233eabd0545ffb4fe35c4deb94698c.webp?v=1740250848,"EUR 29,95",in stock,IB_TX_DE,Vohänge & Gardinen
IB_HA_DE_3,Weinflaschenhalter Elefant,"Werten Sie Ihre Weinsammlung und Ihre Wohnkultur mit diesem luxuriösen, hochwertigen Weinflaschenhalter aus kaltgegossenem Polyresin auf. Handbemalt und sorgfältig poliert, verleiht dieses exquisite Elefantengesicht Ihrer Weinbar oder Ihrem Essbereich Eleganz, Charme und einen Hauch von Exotik.",https://imperialbazaar.com/de/products/weinflaschenhalter-elefantenkopf-handbemalt-resin,https://cdn.shopify.com/s/files/1/0756/5085/9276/files/PNm4KL-1200x1200.jpg?v=1747578979,EUR 175,in stock,IB_HD_DE,Weinflaschenhalter
IB_FU_DE_4,Esszimmerstuhl-Set im skandinavischen Stil,"Modern, farbenfroh und bequem – dieses 8-teilige Stuhlset von Egoonm bringt skandinavisches Design in Ihr Zuhause. Mit ihrem Patchwork-Stoff, der geschwungenen Form und den stabilen Holzbeinen sind diese Stühle ein echter Hingucker für Ihre Küche, Esszimmer oder Home-Office.",https://imperialbazaar.com/de/products/skandinavische-stuehle-set-egoonm,https://cdn.shopify.com/s/files/1/0756/5085/9276/files/H2822089605244bb2a259439d2cfc8687w.jpg?v=1747579038,"EUR 299,95",in stock,IB_FU_DE,Küchen- und Esszimmerstühle
IB_FU_DE_5,Beistelltisch aus Altholz,"Dieser rustikale Beistellschrank wurde aus massivem, recyceltem Holz handgefertigt und vereint natürlichen Charme mit praktischer Aufbewahrung. Drei individuell gestaltete Schubladen mit Eisenknöpfen verleihen ihm Vintage-Flair – ideal für Schlafzimmer, Flur oder Wohnzimmer. Jedes Möbelstück ist einzigartig: Gefertigt aus recyceltem Teak-, Mango-, Akazien- oder Saalholz mit individueller Maserung und Geschichte.",https://imperialbazaar.com/de/products/vintage-cabinet,https://cdn.shopify.com/s/files/1/0756/5085/9276/files/Sb56292e6191f4777b3aaee933873b376c.jpg?v=1747578993,EUR 159,in stock,IN_FU_DE,Beistelltische
IB_HA_DE_6,Fischvase Dolomit,"Man kann nie genug Vasen haben, und diese ist ein wahres Kunstwerk. Die Keramikvase „ LIKE A FISH IN THE SEA“ ist mehr als nur ein Gefäß – sie ist ein echter Blickfang. Aus Dolomit gefertigt und mit einem fantasievollen Twist gestaltet, scheint der Fisch mühelos durch die Vase zu gleiten und erzeugt so ein Gefühl von Bewegung und Staunen. Sie zieht sofort die Blicke auf sich und braucht vielleicht nicht einmal Blumen, um zu glänzen.",https://imperialbazaar.com/de/products/vase-fish-dolomite-mint-white-orange-23x12-5x21cm-1203462560,https://cdn.shopify.com/s/files/1/0756/5085/9276/files/203959-c.jpg?v=1747579074,"EUR 39,95",in stock,IN_HD_DE,Vasen
